id	name	code1	k43-завод	мид-завод	k43-кооп	мид-кооп	нал-4310	нал мидкам	temp1	price1	price1_name	price2	price2_name	price3	price3_name	price4	price4_name	lk1	lk2	lk3	lk4	cat	cat2	url	path	ord	code2	code3	4310	4326	43114	43118	43261	4350	6450	prim	prim2	img_path	img1	img2	img3	img4	img5	par1	text1	par2	text2	par3	text3	w	h	l	m	desc	Comment	desc1
429	Ступица колеса (голый)	43114-3103015-20	12 840			7 000	1-	-0		15 600	завод, с НДС		аналог Ижевск					4310-2304090	4310-2502020			Мост передний		stupitsa-kolesa-golyj-43114-3103015-10	/kamaz-4310/catalog/zapchasti/	429			1	1						КамАЗ-4310, КамАЗ-4326, КамАЗ-43101		/kamaz-4310/img/zap/	43114-3103015-10_2.jpg											0.32	0.25	0.32	55.5	Ступица представляет собой отливку из высокопрочного чугуна с фланцем для крепления колес, посадочными местами под подшипники, манжету и ротор датчика скорости. Предназначена под дисковые колеса		
431	Усилитель пневмогидравлический ПГУ сцепления в сборе	5320-1609510	9 651	4 180		2 350	1-	0-1		11 200	завод, в наличии	5 230	аналог Наб.Челны					142-1601090	43114-3103015-20	14-1601090-10	#REF!	Сцепление		usilitel-pnevmogidravlicheskij-pgu-stsepleniya-v-sbore-5320-1609510	/kamaz-4310/catalog/zapchasti/	431			1	1	1	1	1			КамАЗ-4310, КамАЗ-4326, КамАЗ-5315, КамАЗ-5320, КамАЗ-53212, КамАЗ-5410, КамАЗ-54112, КамАЗ-5511, КамАЗ-55102, КамАЗ-65115, КамАЗ-5297, КамАЗ-43101, КамАЗ-6540, КамАЗ-43114, КамАЗ-43118, КамАЗ-4326, КамАЗ-53228, 65111, КамАЗ-43261 (Евро-1, 2), МАЗ-555142.		/kamaz-4310/img/zap/	5320-1609510_2.jpg											0.245	0.139	0.03	0.51	Пневмогидроусилитель 5320-1609510 имеет чугунный корпус и алюминиевую заднюю крышку.		
433	Фланец ведущего вала (круглый, Евро)	53205-2402036	7 800	8 600			1-	1-		11 900	завод, в наличии							53205-2402036	5320-2402036	6520-2502036		Мост передний	Фланец	flanets-vedushchego-vala-kruglyj-evro-53205-2402036	/kamaz-4310/catalog/zapchasti/	433										КамАЗ-65115, КамАЗ-6540, КамАЗ-43114, КамАЗ-43118, КамАЗ-4326 (каталог 2003г), КамАЗ-53228, 65111, КамАЗ-65116, КамАЗ-43501 (4х4), КамАЗ-53501 (6х6), КамАЗ-53504 (6х6), КамАЗ-6450 8х8, КамАЗ-63501 8х8, КамАЗ-4350 (4х4), КамАЗ-5350 (6х6), КамАЗ-6350 (8х8), КамАЗ-4308 (2008), КамАЗ-43261 (Евро-1, 2).		/kamaz-4310/img/zap/	53205-2402036_2.jpg											0.15	0.085	0.15	2.66			
435	Фланец ведущего вала в сборе заднего моста	5320-2402036	2 587	3 700			1-	1-		5 400	завод							53205-2402036	53205-2402036	6520-2502036		Мост задний	Фланец	flanets-vedushchego-vala-v-sbore-zadnego-mosta-5320-2402036	/kamaz-4310/catalog/zapchasti/	435			1	1	1	1	1			КамАЗ-4310, КамАЗ-4326, КамАЗ-5320, КамАЗ-53212, КамАЗ-5410, КамАЗ-54112, КамАЗ-5511, КамАЗ-55102, КамАЗ-65115, КамАЗ-43101, КамАЗ-43114, КамАЗ-43118.		/kamaz-4310/img/zap/	5320-2402036_2.jpg											0.12	0.083	0.1				
437	Фланец ведущего вала РК переднего моста	53205-2402036	7 800	8 600			1-	1-		9 300	завод							53205-2402036	5320-2402036	6520-2502036	6520-2502037	Мост передний	Фланец	flanets-vedushchego-vala-rk-perednego-mosta-53205-2402036	/kamaz-4310/catalog/zapchasti/	437				1	1	1	1			КамАЗ-43114, КамАЗ-43118, КамАЗ-4326 (каталог 2003г), КамАЗ-53228, 65111, КамАЗ-65116, КамАЗ-43501 (4х4), КамАЗ-53501 (6х6), КамАЗ-53504 (6х6), КамАЗ-6450 8х8, КамАЗ-63501 8х8, КамАЗ-4350 (4х4), КамАЗ-5350 (6х6), КамАЗ-6350 (8х8), КамАЗ-4308 (2008), КамАЗ-43261 (Евро-1, 2).		/kamaz-4310/img/zap/	53205-2402036-2_2.jpg											0.15	0.085	0.15	2.66			
439	Фланец ведущий сред. и зад/моста -6520,-6460	6520-2502036	2 300				0-	-		4 500	завод, уточняйте - поможем найти							4310-1802150	43114-1802152	4310-1802150	6520-2502037	Коробка раздаточная	Фланец	flanets-vedushchij-sred-i-zad-mosta_6520-2502036	/kamaz-4310/catalog/zapchasti/	439							1	1	1	КамАЗ-43261 (Евро-1, 2), КамАЗ-4350 (4х4), КамАЗ-43501 (4х4), КамАЗ-5297, КамАЗ-5460 (каталог 2005 г.), КамАЗ-6460, КамАЗ-6520, КамАЗ-6520 (Euro-2, 3), КамАЗ-6522, КамАЗ-65226	задний мост и передний мост	/kamaz-4310/img/zap/	6520-2502036_2.jpg											0.18	0.075	0.18	3.56	На 036 два пыльника и ставятся на вход,на 037 один пыльник на выход. Все остальное идентично.	Фланец ведущего вала ЗМ и ПМ КамАЗ-6520, 1 маслоотражатель	
443	Фланец ведущий ступицы переднего колеса	4310-2304090	5 500	6 000	1 730	1 760	1-0	0-0		8 300	завод	1 990	аналог Наб.Челны					43114-3103015-20	43114-3103015-20	6520-2502037	Фланец ведущего вала РК переднего моста	Мост передний	Фланец	flanets-vedushchij-stupitsy-perednego-kolesa-4310-2304090	/kamaz-4310/catalog/zapchasti/	443			1	1	1	1	1	1	1	КамАЗ-4310, КамАЗ-43101, КамАЗ-43114, КамАЗ-43118, КамАЗ-4326, КамАЗ-43261 (Евро-1, 2), КамАЗ-4350 (4х4), КамАЗ-43501 (4х4), КамАЗ-53228, 65111		/kamaz-4310/img/zap/	4310-2304090_2.jpg																	
445	Фланец КамАЗ-6520,6460 ведущий среднего моста	6520-2502037	7 550				0-	-		9 800	завод, уточняйте - поможем найти							4310-2304090	53205-2402036	6520-2502036	53205-2402036	Мост средний	Фланец	flanets-kamaz-65206460-vedushchij-srednego-mosta-6520-2502037	/kamaz-4310/catalog/zapchasti/	445							1	1	1	КамАЗ-6460, КамАЗ-6520, КамАЗ-6522, Мосты КамАЗ-6522, КамАЗ-6520 (Euro-2, 3), КамАЗ-6522 (Euro-2, 3), КамАЗ-65226.	задний мост и передний мост	/kamaz-4310/img/zap/	6520-2502037_2.jpg											0.18	0.075	0.18	3.56	На 036 два пыльника и ставятся на вход,на 037 один пыльник на выход. Все остальное идентично.	Фланец ведущего вала ЗМ и ПМ КамАЗ-6520, 1 маслоотражатель	
449	Фланец КПП 240 круглый (8 отв.) 	152-1701240	4 487				1-	-		6 500	завод							14-1701130				Коробка передач	Фланец	flanets-kpp-kruglyj-152.1701240	/kamaz-4310/catalog/zapchasti/	449									1	КамАЗ-5315, КамАЗ-5320, КамАЗ-53212, КамАЗ-5410, КамАЗ-54112, КамАЗ-5511, КамАЗ-55102, КамАЗ-5297, 740.11-240, 740.31-240 (2006).	КамАЗ КПП-14, 15	/kamaz-4310/img/zap/	152.1701240_2.jpg											0.205	0.082	0.205	3.5			
455	Цапфа поворотного кулака передняя правая в сборе	4310-2304080					-	-		-	под заказ, с хранения, не выпускается	15 870	взаимо-заменяемый - 43114-2304080					4310-2304081	4310-2401081	4310-2304081	4310-2401080	Подвод воздуха к шинам		tsapfa-povorotnogo-kulaka-v-sbore-4310-2304080	/kamaz-4310/catalog/zapchasti/	455			1	1	1	1	1	1	1	КамАЗ-4310, КамАЗ-43101, КамАЗ-43114, КамАЗ-43118, КамАЗ-4326, КамАЗ-43261 (Евро-1, 2), КамАЗ-4350 (4х4), КамАЗ-43501 (4х4), КамАЗ-53228, 65111	для переднего ведущего моста автомобиля	/kamaz-4310/img/zap/	4310-2304080_2.jpg											0.24	0.22	0.22	10		Цапфа кулака поворотного КАМАЗ-4310,43114 правая (ПАО КАМАЗ). Цапфа - ось заднего колеса автомобиля.	
459	Цапфа поворотного кулака передняя левая в сборе	4310-2304081					-	-		-	под заказ, с хранения, не выпускается	15 870	взаимо-заменяемый - 43114-2304081					4310-2304080	4310-2401080	4310-2401081	43114-2304081	Подвод воздуха к шинам		tsapfa-povorotnogo-kulaka-v-sbore-4310-2304081	/kamaz-4310/catalog/zapchasti/	459			1	1	1	1	1	1	1	КамАЗ-4310, КамАЗ-43101, КамАЗ-43114, КамАЗ-43118, КамАЗ-4326, КамАЗ-43261 (Евро-1, 2), КамАЗ-4350 (4х4), КамАЗ-43501 (4х4), КамАЗ-53228, 65111, КамАЗ-6450	ось передняя	/kamaz-4310/img/zap/	4310-2304080_2.jpg											0.25	0.239	0.252	13.2		Цапфы на передний и задний мост имеют одинаковую основу 4310-2304085/084 ● На передний мост устанавливается втулка бронзовая на задний мост нет	
463	Цапфа поворотного кулака задняя правая в сборе	4310-2401080					-	-		-	под заказ, с хранения, не выпускается	15 870	взаимо-заменяемый - 43114-2401080					4310-2401081	4310-2304081	4310-2304080	4310-2401081	Подвод воздуха к шинам		tsapfa-povorotnogo-kulaka-pravaya-v-sbore-4310-2401080	/kamaz-4310/catalog/zapchasti/	463			1	1	1	1	1	1	1	КамАЗ-4310, КамАЗ-43101, КамАЗ-43114, КамАЗ-43118, КамАЗ-4326, КамАЗ-43261 (Евро-1, 2), КамАЗ-4350 (4х4), КамАЗ-43501 (4х4), КамАЗ-53228, 65111, КамАЗ-6450	ось заднего колеса автомобиля.	/kamaz-4310/img/zap/	4310-2401080_2.jpg											0.25	0.239	0.252	13.2	в сборе, с головкой подвода воздуха	Произошла замена шланга с 4310-3125050-20 на 5320-3125060-20 и замена штуцера с 4310-3124065 на 4310-3124066.	
451	Цапфа заднего моста левая в сборе 43114/4310	4310-2401081					-	-		-	под заказ, с хранения, не выпускается	15 870	взаимо-заменяемый - 43114-2401081					4310-2401080	43114-2401081	4310-2304081	4310-2401080	Подвод воздуха к шинам		tsapfa-levaya-v-sbore-4310-2401081	/kamaz-4310/catalog/zapchasti/	451			1	1	1	1	1	1		КамАЗ-4310, КамАЗ-43101, КамАЗ-43114, КамАЗ-43118, КамАЗ-4326, КамАЗ-43261 (Евро-1, 2), КамАЗ-4350 (4х4), КамАЗ-43501 (4х4)		/kamaz-4310/img/zap/	4310-2401081_2.jpg											0.275	0.275	0.227	12.56	 Цапфа заднего моста КамАЗ-43261 (Евро-1, 2)		
461	Цапфа поворотного кулака передняя левая в сборе	43114-2304081	13 257	15 165		10 400	1-	1-0		15 870	завод, в наличии							43114-2304080	4310-2304081	43114-2401081	43114-2401080	Подвод воздуха к шинам		tsapfa-povorotnogo-kulaka-v-sbore-43114-2304081	/kamaz-4310/catalog/zapchasti/	461							1	1	1	КамАЗ-43501 (4х4), КамАЗ-53501 (6х6), КамАЗ-53504 (6х6), КамАЗ-6450 8х8, КамАЗ-63501 8х8, КамАЗ-43261 (Евро-1, 2)	ось передняя	/kamaz-4310/img/zap/	43114-2304081_2.jpg											0.25	0.239	0.252	13.2		Цапфа левая КамАЗ-43114, 43118 ,4326	
457	Цапфа поворотного кулака передняя правая в сборе	43114-2304080	13 257	15 165		11 600	1-	1-0		15 870	завод, в наличии							43114-2304081	4310-2304080	43114-2401081	43114-2401080	Подвод воздуха к шинам		tsapfa-povorotnogo-kulaka-v-sbore-43114-2304080	/kamaz-4310/catalog/zapchasti/	457							1	1	1	КамАЗ-43501 (4х4), КамАЗ-53501 (6х6), КамАЗ-53504 (6х6), КамАЗ-6450 8х8, КамАЗ-63501 8х8, КамАЗ-43261 (Евро-1, 2).	ось передняя	/kamaz-4310/img/zap/	43114-2304080_2.jpg											0.22	0.22	0.22	10		Цапфа правая КамАЗ-43114, 43118, 4326	
465	Цапфа заднего моста правая в сборе 	43114-2401080	11 908				1-	-		15 870	завод, в наличии							43114-2401081	4310-2401080	43114-2304081	43114-2401081	Подвод воздуха к шинам		tsapfa-povorotnogo-kulaka-pravaya-v-sbore-43114-2401080	/kamaz-4310/catalog/zapchasti/	465							1	1	1	КамАЗ-43501 (4х4), КамАЗ-53501 (6х6), КамАЗ-53504 (6х6), КамАЗ-6450 8х8, КамАЗ-63501 8х8, КамАЗ-43261 (Евро-1, 2)	ось заднего колеса автомобиля.	/kamaz-4310/img/zap/	4310-2401080_2.jpg											0.25	0.239	0.252	13.2	в сборе, с головкой подвода воздуха	Произошла замена шланга с 4310-3125050-20 на 5320-3125060-20 и замена штуцера с 4310-3124065 на 4310-3124066.	
453	Цапфа заднего моста левая в сборе	43114-2401081	11 908				1-	-		15 870	завод, в наличии							43114-2401080	4310-2401081	43114-2304081	43114-2401080	Подвод воздуха к шинам		tsapfa-levaya-v-sbore-43114-2401081	/kamaz-4310/catalog/zapchasti/	453					1	1	1	1		КамАЗ-43118 (Евро 4), КамАЗ-43261 (Евро-1, 2), КамАЗ-43501 (4х4), КамАЗ-43501 (4х4)	заднего моста	/kamaz-4310/img/zap/	43114-2401081_2.jpg											0.25	0.25	0.25	12.5		Цапфа заднего моста левая У цапфу 43114-2401081 и 43114-2304079 - одинаковые голые цапфы 43114-2304084/85. Остальные детали различаются. 	
467	Чашка МОД межосевого дифференциала задняя	5320-2506019					-	-		-	завод, НЕТ в наличии							5320-2402120-40	5320-2402120-10	5320-2502017		Мост задний		chashka-mod-mezhosevogo-differentsiala-zadnyaya-5320-2506019	/kamaz-4310/catalog/zapchasti/	467					1	1	1	1	1	КамАЗ-43118, КамАЗ-43501, КамАЗ-5320, КамАЗ-53501, КамАЗ-5410, КамАЗ-6450, КамАЗ-6540	средний (промежуточный) мост	/kamaz-4310/img/zap/	5320-2506019_2.jpg											0.157	0.157	0.261	7.1		Чашки 5320-2506016 и 53205-2506016 внешне отличаются только отверстиями для смазки. На 5320 они расположены радиально. На задней чашке 53205-2506019 отверстий не предусмотрено. Комплекты по установочным размерам идентичны. Вместо 5320 можно установить 53205.	
		53205-2506019					-	-																																																
	Чашка МКД к-т	53229-2403016	46 000	44 500			1-	1-		51 320	завод																																													
	Чашка МКД к-т	53205-2403016	26 250				1-	-		29 900	завод, в наличии																																													
		4310-2403016					-	-																																																
							-	-																																																
							-	-																																																
469	Шестерня ведомая цилиндрическая 47 зубьев	5320-2402120-40	12 950	14 200			1-	0-		16 100	завод, в наличии							5320-2402120-10	5320-2402120-10			Мост передний	Шестерни	shesternya-vedomaya-tsilindricheskaya-47-zubev-5320-2402120-40	/kamaz-4310/catalog/zapchasti/	469							1	1	1	КамАЗ-43261 (Евро-1, 2), КамАЗ-4350 (4х4), КамАЗ-43501 (4х4), КамАЗ-5320, КамАЗ-53212, КамАЗ-53228, 65111, КамАЗ-5410, КамАЗ-54112, КамАЗ-55102, КамАЗ-5511, КамАЗ-65115, КамАЗ-65116		/kamaz-4310/img/zap/	5320-2402120-40_2.jpg											0.075	0.305	0.305	13.58	Устанавливается на автомобилях КамАЗ – 43114, 43118, 43253, 43255, 4326, 43269, 4350, 43502, 44108, 5320, 53228, 53229, 5350, 53501, 53504, 55111, 6350, 63501, 63502, 6450, 65115, 65117.  Гарантированный ресурс детали – 350 тыс. км.		
471	Шестерня ведомая цилиндрическая 49 зубьев	5320-2402120-10	11 000	9 900			1-	1-		13 200	завод							5320-2402120-40	5320-2402017	5320-2402060	5320-2506019	Мост передний	Шестерни	shesternya-vedomaya-tsilindricheskaya-49-zubev-5320-2402120-10	/kamaz-4310/catalog/zapchasti/	471							1	1	1	КамАЗ-43261 (Евро-1, 2), КамАЗ-4350 (4х4), КамАЗ-43501 (4х4), КамАЗ-5320, КамАЗ-53212, КамАЗ-53228, 65111, КамАЗ-5410, КамАЗ-54112, КамАЗ-55102, КамАЗ-5511, КамАЗ-65115, КамАЗ-65116		/kamaz-4310/img/zap/	5320-2402120-10_2.jpg											0.318	0.07	0.318	12.74			
		5320-2402020	27 500	28 200			1-	1-		33 200	завод																																													
473	Шестерня ведущая коническая заднего моста в сборе	5320-2402017	15 000				0-	-		17 500	завод, под заказ							5320-2402060	5320-2502017	53212-2506126	53212-2506130	Редуктор	Шестерни	shesternya-vedushchaya-konicheskaya-pered-i-zadn-mosta-v-sbore-5320-2402017	/kamaz-4310/catalog/zapchasti/	473			1	1	1	1	1	1		КамАЗ-4310, КамАЗ-43101, КамАЗ-43114, КамАЗ-43118, КамАЗ-4308, КамАЗ-4326, КамАЗ-43261 (Евро-1, 2), КамАЗ-4350 (4х4), КамАЗ-43501 (4х4), КамАЗ-5320, КамАЗ-53212, КамАЗ-53228, 65111, КамАЗ-5410, КамАЗ-54112, КамАЗ-55102, КамАЗ-5511, КамАЗ-65115, КамАЗ-65116, КамАЗ-6540		/kamaz-4310/img/zap/	5320-2402017_2.jpg											0.14	0.14	0.1	4.05			
475	Шестерня ведущая коническая заднего моста в сборе	5320-2402060	13 500				1-	-		17 200	завод, под заказ							5320-2402017	5320-2502017	53212-2506126	53212-2506130	Редуктор	Шестерни	shesternya-vedushchaya-konicheskaya-pered-sredn-zadn-mosta-v-sbore-5320-2402060	/kamaz-4310/catalog/zapchasti/	475			1	1	1	1	1	1	1	КамАЗ-4310, КамАЗ-43101, КамАЗ-4308, КамАЗ-43114, КамАЗ-43118, КамАЗ-4326, КамАЗ-43261 (Евро-1, 2), КамАЗ-4350 (4х4), КамАЗ-43501 (4х4), КамАЗ-5320, КамАЗ-53212, КамАЗ-53228, 65111, КамАЗ-5410, КамАЗ-54112, КамАЗ-55102, КамАЗ-5511, КамАЗ-65115, КамАЗ-65116, КамАЗ-6540		/kamaz-4310/img/zap/	5320-2402060_2.jpg		5320-2402060_4.jpg									0.23	0.074	0.23	7.65			
		5320-2502020	27 500				1-	-		31 000																																														
476	Шестерня ведущая коническая среднего моста в сборе	5320-2502017	7 150	4 850	4 750		0-1	1-		9 500	завод, под заказ													shesternya-konicheskaya-srednego-mosta-vedushchaya-5320-2502017	/kamaz-4310/catalog/zapchasti/	476										КамАЗ-4310, КамАЗ-43101, КамАЗ-4308, КамАЗ-43114, КамАЗ-43118, КамАЗ-4326, КамАЗ-43261 (Евро-1, 2), КамАЗ-4350 (4х4), КамАЗ-43501 (4х4), КамАЗ-5320, КамАЗ-53212, КамАЗ-53228, 65111, КамАЗ-5410, КамАЗ-54112, КамАЗ-55102, КамАЗ-5511, КамАЗ-65115, КамАЗ-65116, КамАЗ-6540		/kamaz-4310/img/zap/	5320-2402017_2.jpg											0.14	0.14	0.1	4.05			
	Шестерня ведущая коническая среднего моста в сборе	5320-2502060, 5320-2402060					-	-																																																
477	Шестерня ведущая первичного вала РК (раздаточной коробки) в сборе	43114-1802034	12 752		10 000	7 953	1-0	-0		14 780	завод	11 500	аналог Наб.Челны					43114-1802189	43114-1802090	4310-1802034	65111-1802034	Коробка раздаточная	Шестерни	shesternya-vedushchaya-pervichnogo-vala-rk-razdatochnoj-korobki-v-sbore-43114-1802034	/kamaz-4310/catalog/zapchasti/	477					1	1	1			КамАЗ-43114, КамАЗ-43118, КамАЗ-4326, КамАЗ-4326 (каталог 2003г), КамАЗ-43261 (Евро-1, 2), КамАЗ-53228, 65111		/kamaz-4310/img/zap/	43114-1802034_2.jpg											0.205	0.205	0.076	8.7			
479	Шестерня ведущая первичного вала РК (раздаточной коробки) в сборе	4310-1802034	10 450				1-	-		12 750	завод, под заказ	0	с хранения, по запросу					4310-1802034	4310-1802189	43114-1802034	65111-1802034	Коробка раздаточная	Шестерни	shesternya-vedushchaya-pervichnogo-vala-rk-razdatochnoj-korobki-v-sbore-4310-1802034	/kamaz-4310/catalog/zapchasti/	479			1							КамАЗ-4310		/kamaz-4310/img/zap/	43114-1802034_2.jpg											0.205	0.205	0.076	8.7			
481	Шестерня ведущая первичного вала РК (раздаточной коробки) в сборе	65111-1802034	17 820			1 200	1-	-0		21 000	завод							65111-1802090-10	65111-1802180	4310-1802034	43114-1802034	Коробка раздаточная	Шестерни	shesternya-vedushchaya-pervichnogo-vala-rk-razdatochnoj-korobki-v-sbore-65111-1802034	/kamaz-4310/catalog/zapchasti/	481							1	1	1	КамАЗ-4350 (4×4), -5350 (6×6), -6350 (8×8), -43261 (Евро-1, -2), -43501 (4×4), -53501 (6×6), -53504 (6×6), -6450 (8×8), -63501 (8×8).		/kamaz-4310/img/zap/	65111-1802034_2.jpg											0.206	0.206	0.093	8.0	36 зубов, усиленная	Шестерня имеет круглую форму с зубьями по краю. Основная функция шестерни передача вращательного движения от одной оси к другой.	
483	Шестерня ведущая цилиндрическая (13 зубьев)	5320-2402110-10	7 250	7 500			1-	1-		9 800	завод							5320-2402110-40	5320-2502017	5320-2402060	5320-2402017	Мост задний	Шестерни	shesternya-vedushchaya-tsilindricheskaya-13-zubev-5320-2402110-10	/kamaz-4310/catalog/zapchasti/	483							1			КамАЗ-43261 (Евро-1, 2), КамАЗ-53228, 65111, КамАЗ-65115, КамАЗ-65116		/kamaz-4310/img/zap/	5320-2402110-10_2.jpg											0.125	0.11	0.27	6.7			
485	Шестерня ведущая цилиндрическая (15 зубьев)	5320-2402110-40	8 700	11 220			1-	1-		12 300	завод							5320-2402110-10	5320-2502017	5320-2402060	5320-2402017	Мост задний	Шестерни	shesternya-vedushchaya-tsilindricheskaya-15-zubev-5320-2402110-40	/kamaz-4310/catalog/zapchasti/	485							1			КамАЗ-43261 (Евро-1, 2), КамАЗ-53228, 65111, КамАЗ-65115, КамАЗ-65116	задний мост	/kamaz-4310/img/zap/	5320-2402110-40_2.jpg											0.105	0.105	0.27	6.6			
487	Шестерня коническая среднего моста ведущая	5320-2502017	7 150	4 850	4 750		0-1	1-		8 200	завод, под заказ							5320-2402017	5320-2402060	53212-2506126	53212-2506130	Редуктор	Шестерни	shesternya-konicheskaya-srednego-mosta-vedushchaya-5320-2502017	/kamaz-4310/catalog/zapchasti/	487					1	1	1	1		КамАЗ-43114, КамАЗ-43118, КамАЗ-4326, КамАЗ-43261 (Евро-1, 2), КамАЗ-43501 (4х4), КамАЗ-5320, КамАЗ-53212, КамАЗ-53228, 65111, КамАЗ-5410, КамАЗ-6540		/kamaz-4310/img/zap/	5320-2502017_2.jpg											0.15	0.15	0.25	6.25			
489	Шестерня низшей передачи привода заднего моста в сборе (43зуб) 4310/43114	4310-1802189	13 000				1-	-		15 000	завод, под заказ			8 860	с хранения, по запросу			4310-1802034	4310-1802090	43114-1802189		Коробка раздаточная	Шестерни	shesternya-nizshej-peredachi-privoda-zadnego-mosta-v-sbore-4310-1802189	/kamaz-4310/catalog/zapchasti/	489			1	1						КамАЗ-4310, КамАЗ-4310 (каталог 2004 г), КамАЗ-43101, КамАЗ-4326		/kamaz-4310/img/zap/	4310-1802189_2.jpg											0.241	0.241	0.117	10.1	у шестерни 43114 посадочное место стало короче чем на 4310 и без паза под стопорное кольцо		
491	Шестерня низшей передачи раздаточной коробки (43зуб, с бронз.втулкой) 43114(4310)	43114-1802189	16 000			10 700	0-	-0		18 500	завод							43114-1802090	4310-1802189	43114-1802088	4310-1802180	Коробка раздаточная	Шестерни	shesternya-nizshej-peredachi-razdatochnoj-korobki-43114-1802189	/kamaz-4310/catalog/zapchasti/	491				1	1	1	1			КамАЗ-43114, КамАЗ-43118, КамАЗ-4326 (каталог 2003г), КамАЗ-43261 (Евро-1, 2), КамАЗ-53228, 65111		/kamaz-4310/img/zap/	43114-1802189_2.jpg											0.241	0.241	0.117	10.1	у шестерни 43114 посадочное место стало короче чем на 4310 и без паза под стопорное кольцо		
