id	name	code1	k43-завод	мид-завод	k43-кооп	мид-кооп	нал-4310	нал мидкам	temp1	price1	price1_name	price2	price2_name	price3	price3_name	price4	price4_name	lk1	lk2	lk3	lk4	cat	cat2	url	path	ord	code2	code3	4310	4326	43114	43118	43261	4350	6450	prim	prim2	img_path	img1	img2	img3	img4	img5	par1	text1	par2	text2	par3	text3	w	h	l	m	desc	Comment	desc1
369	Дифференциал РК (раздаточной коробки) в сборе	43114-1802152	83 541	86 008			0-	0-		97 500	завод, без НДС		аналог Наб.Челны					4310-1802150	65111-1802152-10	43114-1802155	43114-1802085	Коробка раздаточная	Диф	differentsial-rk-razdatochnoj-korobki-v-sbore-43114-1802150	/kamaz-4310/catalog/zapchasti/	369	43114-1802152			1	1	1	1			КамАЗ-43114, КамАЗ-43118, КамАЗ-4326 (каталог 2003г), КамАЗ-53228, 65111, КамАЗ-43261 (Евро-1, 2)		/kamaz-4310/img/zap/	43114-1802150_2.jpg											0.24	0.24	0.47	43.6	подходит на 4310 (хвостовик под фланец на 10 шлицов), замена на 43114-1802152	 Хвостовик под фланец на 10 шлицов. Установка 43114 вместо 4310 возможна. Дифференциал 43114 отличается от 4310 следующим: разные обоймы дифференциала, отличающиеся способом крепления к шестерни низшей передачи, и вместо шестерни низшей передачи 4310-1802189 установлена 43114 с  измененной ступицей. 43114-1802150 И 43114-1802152  - отличие 152 поставляется в запчасти, т.е. в комплекте с подшипниками. 150 - подшипники без кольца наружного. Сегодня эту РК не выпускают, вместо нее делают 65111. Если Вы приобретете 150 значит Вам надо найти колечки, а они отдельно не продаются. Значит надо покупать подшипник.	
371	Картер привода переднего моста в сборе (4310-, 43114-1802230)	43114-1802230	39 500				0-	-		45 750	завод, нет в наличии		аналог Наб.Челны					65111-1802230-10	4310-1804010			Коробка раздаточная		karter-privoda-perednego-mosta-v-sbore-4310-1802230	/kamaz-4310/catalog/zapchasti/	371			1	1	1	1	1	1		КамАЗ-4310, КамАЗ-43101, КамАЗ-43114, КамАЗ-43118, КамАЗ-4326, КамАЗ-43261 (Евро-1, 2), КамАЗ-53228, 65111, 		/kamaz-4310/img/zap/												0.215	0.28	0.452	17.5			
373	Картер привода переднего моста в сборе	65111-1802230-10	43 000	37 564			1-	1-		49 850	завод, нет в наличии		аналог Наб.Челны					43114-1802230	4310-1804010			Коробка раздаточная		karter-privoda-perednego-mosta-v-sbore-65111-1802230-10	/kamaz-4310/catalog/zapchasti/	373							1	1	1	КамАЗ-43261 (Евро-1, 2) , КамАЗ-4350 (4х4), КамАЗ-43501 (4х4) 		/kamaz-4310/img/zap/												0.28	0.28	0.486	17.5	Картер используется для защиты кривошипно- шатунного механизма от загрязнений и протечки масла. Так же он выполняет функцию резервуара для хранения моторного масла.<br />Артикул — 65111-1802230-10<br />Дополнительное описание - Картер КАМАЗ-ЕВРО-1, 2 привода переднего моста в сборе (ОАО КАМАЗ)<br />Применение: Применяется для раздаточной коробки и трансмиссии автомобиля.<br />Применение: Применяется для автомобилей КамАЗ-43261 (Евро-1, 2)		
375	Колеса зубчатые ведущее и ведомое конические (комплект после спаривания)	4310-2502020	13 475	15 500			1-	1-		18 450	завод		аналог Наб.Челны					4310-1802034	4310-1802189			Мост средний		kolesa-zubchatye-vedushchee-i-vedomoe-konicheskie-komplekt-posle-sparivaniya-4310-2502020	/kamaz-4310/catalog/zapchasti/	375			1	1	1	1	1			КамАЗ-4310, КамАЗ-43101, КамАЗ-4326, КамАЗ-43261 (Евро-1, 2), КамАЗ-5320, КамАЗ-53212, КамАЗ-5410, КамАЗ-54112, КамАЗ-55102, КамАЗ-5511		/kamaz-4310/img/zap/	4310-2502020_2.jpg											0.23	0.185	0.23	11.6	Пара коническая КАМАЗ среднего моста	Комплект конических шестерен СМ	
		5320-2402020	27 500	28 200			1-	1-		32 680																																														
377	Кольцо упорное	4310-2304129	750		345		1-1	-		1 245	завод, в наличии							4310-2304067	4310-2304064			Мост передний		koltso-upornoe-4310-2304129	/kamaz-4310/catalog/zapchasti/	377			1	1	1	1	1	1	1	КамАЗ-4310, КамАЗ-4326, КамАЗ-43101, КамАЗ-43114, КамАЗ-43118, КамАЗ-53228, 65111, КамАЗ-43501 (4х4), КамАЗ-53501 (6х6), КамАЗ-6450 8х8, КамАЗ-63501 8х8, КамАЗ-43261 (Евро-1, 2).		/kamaz-4310/img/zap/	4310-2304129_2.jpg											0.128	0.01	0.128	0.45			
379	Крана управления РК (раздаточной коробки) в сборе	4310-1804010	7 100	7 750			0-	1-		9 320	завод, в наличии		аналог Наб.Челны					4310-1803020	4310-2304064			Коробка раздаточная		korpus-krana-upravleniya-rk-razdatochnoj-korobki-4310-1804012	/kamaz-4310/catalog/zapchasti/	379				1	1	1	1	1	1	КамАЗ-43114, КамАЗ-43118, КамАЗ-4326, КамАЗ-43261 (Евро-1, 2), КамАЗ-4350 (4х4), КамАЗ-43501 (4х4), КамАЗ-53228, 65111, 		/kamaz-4310/img/zap/	4310-1804012_kran-upravleniya-razdatkoy-kamaz_2.jpg											0.055	0.09	0.1	0.3			
381	Кулак разжимной левый	43114-3501111	2 151				1-	-		3 000	завод, в наличии	0	аналог Наб.Челны					43114-3501110	4310-2304062	4310-2304064	4310-2304067	Мост передний	Кулаки	kulak-razzhimnoj-levyj-43114-3501111	/kamaz-4310/catalog/zapchasti/	381				1	1	1	1	1	1	КамАЗ-43114, КамАЗ-43118, КамАЗ-4326, КамАЗ-53228, 65111, КамАЗ-43501 (4х4), КамАЗ-53501 (6х6), КамАЗ-53504 (6х6), КамАЗ-6450 8х8, КамАЗ-63501 8х8, КамАЗ-4350 (4х4), КамАЗ-5350 (6х6), КамАЗ-6350 (8х8), КамАЗ-43261 (Евро-1, 2).		/kamaz-4310/img/zap/	43114-3501111_2.jpg					Производитель	Кнорр-Бремзе КАМА					0.11	0.07	0.35	3.45	L=350мм	(ВЗАМЕН 4310-3501111)	
383	Кулак разжимной правый	43114-3501110	2 151				1-	-		3 000	завод, в наличии	0	аналог Наб.Челны					43114-3501111	4310-2304062	4310-2304067	4310-2304064	Мост передний	Кулаки	kulak-razzhimnoj-pravyj-43114-3501110	/kamaz-4310/catalog/zapchasti/	383				1	1	1	1	1	1	КамАЗ-43114, КамАЗ-43118, КамАЗ-4326, КамАЗ-53228, 65111, КамАЗ-43501 (4х4), КамАЗ-53501 (6х6), КамАЗ-53504 (6х6), КамАЗ-6450 8х8, КамАЗ-63501 8х8, КамАЗ-4350 (4х4), КамАЗ-5350 (6х6), КамАЗ-6350 (8х8), КамАЗ-43261 (Евро-1, 2).		/kamaz-4310/img/zap/	43114-3501110_2.jpg					Производитель	Кнорр-Бремзе КАМА					0.11	0.07	0.35	3.45	L=350мм	(ВЗАМЕН 4310-3501110)	
385	Кулак шарнира внутрений левый, короткий 20 шлицов (полуось передняя)	53228-2304065	27 000	28 000		8 470	0-	1-0		31 450	завод, в наличии		аналог Наб.Челны					53228-2304064	4310-2304067	43114-3501111	43114-3501110	Мост передний	Кулаки	kulak-sharnira-vnutrenij-levyj-53228-2304065	/kamaz-4310/catalog/zapchasti/	385				1	1	1	1	1	1	КамАЗ-43114, КамАЗ-43118, КамАЗ-4326, КамАЗ-53228, 65111, КамАЗ-43501 (4х4), КамАЗ-53501 (6х6), КамАЗ-53504 (6х6), КамАЗ-6450 8х8, КамАЗ-63501 8х8, КамАЗ-4350 (4х4), КамАЗ-5350 (6х6), КамАЗ-6350 (8х8), КамАЗ-43261 (Евро-1, 2).	шарнира переднего моста	/kamaz-4310/img/zap/	53228-2304065_2.jpg											0.102	0.08	0.591	10.28		Кулак поворотный	
387	Кулак шарнира внутренний левый, короткий 16 шлицов (полуось передняя)	4310-2304065	15 500	18 000		8 470	0-	1-1		19 200	завод, в наличии		аналог Наб.Челны					4310-2304064	4310-2304062	53228-2304065	53228-2304064	Мост передний	Кулаки	kulak-sharnira-vnutrennij-levyj-4310-2304065	/kamaz-4310/catalog/zapchasti/	387			1	1						КамАЗ-4310, КамАЗ-4326, КамАЗ-43101	Левая внутренняя полуось переднего моста	/kamaz-4310/img/zap/	4310-2304065_2.jpg											0.102	0.08	0.609	10.27		Кулак поворотный	
389	Кулак шарнира внутренний правый, длинный, 20 шлицов (полуось передняя)	53228-2304064	11 900	28 500		9 570	0-	1-1		32 500	завод, в наличии		аналог Наб.Челны					53228-2304065	4310-2304064	43114-3501111	43114-3501110	Мост передний	Кулаки	kulak-sharnira-vnutrennij-pravyj-53228-2304064	/kamaz-4310/catalog/zapchasti/	389				1	1	1	1	1	1	КамАЗ-43114, КамАЗ-43118, КамАЗ-53228, 65111, КамАЗ-43501 (4х4), КамАЗ-53501 (6х6), КамАЗ-53504 (6х6), КамАЗ-6450 8х8, КамАЗ-63501 8х8, КамАЗ-4350 (4х4), КамАЗ-5350 (6х6), КамАЗ-6350 (8х8), КамАЗ-43261 (Евро-1, 2).		/kamaz-4310/img/zap/	53228-2304064_2.jpg											0.08	0.102	1.027	16.31		Кулак поворотный	
391	Кулак шарнира внутренний правый, длинный, 16 шлицов (полуось передняя)	4310-2304064	12 623	19 500		9 570	0-	1-1		24 680	завод, в наличии		аналог Наб.Челны					4310-2304067	4310-2304062	53228-2304065	53228-2304064	Мост передний	Кулаки	kulak-sharnira-vnutrennij-pravyj-4310-2304064	/kamaz-4310/catalog/zapchasti/	391			1	1						КамАЗ-4310, КамАЗ-4326, КамАЗ-43101		/kamaz-4310/img/zap/	4310-2304064_2.jpg											0.08	0.102	1.025	16.31		Кулак поворотный	
393	Кулак шарнира переднего моста наружный	4310-2304062	21 500	22 000		5 500	1-	1-0		25 850	завод, в наличии		аналог Наб.Челны	6 800	с хранения, по запросу			4310-2304064	4310-2304067	43114-3501111	43114-3501110	Мост передний	Кулаки	kulak-sharnira-perednego-mosta-naruzhnyj-4310-2304062	/kamaz-4310/catalog/zapchasti/	393			1	1	1	1	1	1	1	КамАЗ-4310, КамАЗ-43101, КамАЗ-43114, КамАЗ-43118, КамАЗ-4326, КамАЗ-43261 (Евро-1, 2), КамАЗ-4350 (4х4), КамАЗ-43501 (4х4), КамАЗ-53228, 65111		/kamaz-4310/img/zap/	4310-2304062_2.jpg											0.08	0.104	0.313	6.505		Кулак поворотный	
395	Механизм включения высшей передачи	43114-1803012	7 100	7 924			0-	1-		9 750	завод, в наличии		аналог Наб.Челны					43114-1803012	43114-1803010	4310-1803010-10		Коробка раздаточная		mehanizm-vklyucheniya-vysshej-peredachi-43114-1803012	/kamaz-4310/catalog/zapchasti/	395				1	1	1	1	1		КамАЗ-4326, КамАЗ-43114, КамАЗ-43118, КамАЗ-4326 (каталог 2003г), КамАЗ-53228, 65111, КамАЗ-43261 (Евро-1, 2).		/kamaz-4310/img/zap/	43114-1803012_2.jpg											0.1	0.1	0.48	2.2			
397	Механизм включения высшей передачи РК (раздаточной коробки)	65111-1803012	5 670	6 529			1-	1-		9 780	завод, в наличии		аналог Наб.Челны					65111-1803010	43114-1803012	43114-1803010		Коробка раздаточная		mehanizm-vklyucheniya-vysshej-peredachi-rk-razdatochnoj-korobki-65111-1803012	/kamaz-4310/catalog/zapchasti/	397							1	1	1	КамАЗ-43501 (4х4), КамАЗ-53501 (6х6), КамАЗ-53504 (6х6), КамАЗ-6450 8х8, КамАЗ-63501 8х8, КамАЗ-4350 (4х4), КамАЗ-5350 (6х6), КамАЗ-6350 (8х8), КамАЗ-43261 (Евро-1, 2).		/kamaz-4310/img/zap/	65111-1803012_2.jpg											0.15	0.15	0.45	2.0			
399	Механизм включения высшей передачи РК (раздаточной коробки) в сборе 43114/4310	43114-1803012	7 100	7 924			0-	1-		9 320	завод, в наличии		аналог Наб.Челны					43114-1803010	43114-1803012	4310-1803010-10	65111-1803012	Коробка раздаточная		mehanizm-vklyucheniya-vysshej-peredachi-rk-razdatochnoj-korobki-v-sbore-4310-1803012-10	/kamaz-4310/catalog/zapchasti/	399					1	1	1			КамАЗ-43114, КамАЗ-43118, КамАЗ-4326, КамАЗ-43261 (Евро-1, 2), КамАЗ-4350 (4х4), КамАЗ-43501 (4х4), КамАЗ-53228, 65111, 		/kamaz-4310/img/zap/	4310-1803012-10_2.jpg											0.1	0.1	0.5	1.91		Механизмы 43114-1803012 и 4310-1803012-10 включения высшей передачи НЕ взаимозаменяемы.	
401	Механизм включения низшей передачи РК (раздаточной коробки) в сборе	43114-1803010	7 090	6 924			1-	1-		9 210	завод, в наличии		аналог Наб.Челны					43114-1803012	43114-1803012	4310-1803010-10	65111-1803010	Коробка раздаточная		mehanizm-vklyucheniya-nizshej-peredachi-rk-razdatochnoj-korobki-v-sbore-43114-1803010	/kamaz-4310/catalog/zapchasti/	401				1	1	1	1			КамАЗ-4326, КамАЗ-43114, КамАЗ-43118, КамАЗ-53228, 65111, КамАЗ-43261 (Евро-1, 2).		/kamaz-4310/img/zap/	43114-1803010_2.jpg											0.1	0.1	0.45	2.0			
403	Механизм включения низшей передачи РК (раздаточной коробки) в сборе	4310-1803010-10					-	-		-	завод, с консервации, по запросу		аналог Наб.Челны					4310-1804010	43114-1803010	43114-1803012		Коробка раздаточная		mehanizm-vklyucheniya-nizshej-peredachi-rk-razdatochnoj-korobki-v-sbore-4310-1803010-10	/kamaz-4310/catalog/zapchasti/	403			1	1						КамАЗ-4310, КамАЗ-4326, КамАЗ-43101		/kamaz-4310/img/zap/												0.1	0.1	0.45	2.0	Снята с производства. Не взаимозаменяемы с 43114-1803010, но некоторые ремонтники устанавливают. Уточняйте возможность у сотрудников автосервиса.		
405	Механизм включения низшей передачи РК (раздаточной коробки) в сборе	65111-1803010	5 980	6 842			1-	1-		8 980	завод		аналог Наб.Челны					65111-1803012	43114-1803012	43114-1803010	4310-1803010-10	Коробка раздаточная		mehanizm-vklyucheniya-nizshej-peredachi-rk-razdatochnoj-korobki-v-sbore-65111-1803010	/kamaz-4310/catalog/zapchasti/	405							1	1	1	КамАЗ-43501 (4х4), КамАЗ-53501 (6х6), КамАЗ-53504 (6х6), КамАЗ-6450 8х8, КамАЗ-63501 8х8, КамАЗ-4350 (4х4), КамАЗ-5350 (6х6), КамАЗ-6350 (8х8), КамАЗ-43261 (Евро-1, 2).		/kamaz-4310/img/zap/	65111-1803010_2.jpg											0.08	0.08	0.45	2.15			
407	Муфта блокировки дифференциала	4310-1802148	2 599		530		1-1	-		4 485	завод		аналог Наб.Челны					65111-1802148	43114-1802155	4310-1802150		Мост передний		mufta-blokirovki-differentsiala-4310-1802148	/kamaz-4310/catalog/zapchasti/	407			1	1	1	1	1			КамАЗ-4310, КамАЗ-4326, КамАЗ-43101, КамАЗ-43114, КамАЗ-43118, КамАЗ-53228, 65111, КамАЗ-43261 (Евро-1, 2).		/kamaz-4310/img/zap/	4310-1802148_2.jpg											0.09	0.09	0.03	0.78			
409	Муфта блокировки дифференциала	65111-1802148	3 350	3 100	1 200		1-1	0-		5 775	завод		аналог Наб.Челны					4310-1802148	65111-1802155-10	65111-1802152-10		Мост передний		mufta-blokirovki-differentsiala-65111-1802148	/kamaz-4310/catalog/zapchasti/	409							1	1	1	КамАЗ-43501 (4х4), КамАЗ-53501 (6х6), КамАЗ-53504 (6х6), КамАЗ-6450 8х8, КамАЗ-63501 8х8, КамАЗ-43261 (Евро-1, 2).		/kamaz-4310/img/zap/	65111-1802148_2.jpg											0.1	0.04	0.1	0.93			
411	Обойма дифференциала РК (раздаточной коробки) с сателлитами	43114-1802155	36 396			36 380	1-	-0		40 890	завод, в наличии	30 700	завод, в наличии - от частного лица					65111-1802155-10	43114-1802152	43114-1802084	6520-2502036	Коробка раздаточная		obojma-differentsiala-rk-razdatochnoj-korobki-s-satellitami-43114-1802155	/kamaz-4310/catalog/zapchasti/	411				1	1	1	1			КамАЗ-43114, КамАЗ-43118, КамАЗ-4326, КамАЗ-43261 (Евро-1, 2), КамАЗ-53228, 65111		/kamaz-4310/img/zap/	43114-1802155_2.jpg											0.241	0.241	0.306	23.0			
413	Обойма дифференциала РК (раздаточной коробки) с сателлитами	65111-1802155-10	57 240			56 700	0-	-1			завод, НЕТ в наличии	112 000	завод, в наличии без НДС					43114-1802155	65111-1802152-10	65111-1802084-10	6520-2502036	Коробка раздаточная		obojma-differentsiala-rk-razdatochnoj-korobki-s-satellitami-65111-1802155-10	/kamaz-4310/catalog/zapchasti/	413							1			КамАЗ-43261 (Евро-1, 2).		/kamaz-4310/img/zap/	65111-1802155-10_2.jpg	65111-1802155-10_3.jpg										0.241	0.241	0.306	23.0			
415	Опора шаровая поворотного кулака с шкворнями в сборе	4310-2304012	41 500	38 200			1-	1-		34 000	завод, в наличии 2 шт строго без ндс	35 000	с разбора, восстановленные					4310-2304066	5320-3001019	53205-3001019-10		Мост передний		opora-sharovaya-povorotnogo-kulaka-s-shkvornyami-v-sbore-4310-2304012	/kamaz-4310/catalog/zapchasti/	415			1	1	1	1	1	1	1	КамАЗ-4310, КамАЗ-43101, КамАЗ-43114, КамАЗ-43118, КамАЗ-4326, КамАЗ-43261 (Евро-1, 2), КамАЗ-4350 (4х4), КамАЗ-43501 (4х4), КамАЗ-53228, 65111		/kamaz-4310/img/zap/	4310-2304012_2.jpg											0.214	0.284	0.31	18.5			
417	Полуось левая заднего моста КАМАЗ 43118	43118-2403069	46 288	64 900			0-	1-		68 000	завод, в наличии	50 000	с разбора, восстановленные					43118-2403070	53205-2403050			Мост задний		poluos-levaya-43118-2403069	/kamaz-4310/catalog/zapchasti/	417					1	1	1	1	1	КамАЗ-43114, КамАЗ-43118, КамАЗ-4326 (каталог 2003г), КамАЗ-43501 (4х4), КамАЗ-53501 (6х6), КамАЗ-53504 (6х6), КамАЗ-6450 8х8, КамАЗ-63501 8х8, КамАЗ-4350 (4х4), КамАЗ-5350 (6х6), КамАЗ-6350 (8х8), КамАЗ-43261 (Евро-1, 2).		/kamaz-4310/img/zap/	43118-2403069_2.jpg	43118-2403069_1.jpg										0.191	0.191	1.288	24			
419	Полуось правая заднего моста КАМАЗ 43118	43118-2403070	32 500	53 900			1-	1-		58 000	завод, в наличии	40 000	с разбора, восстановленные					43118-2403069	53205-2403050			Мост задний		poluos-pravaya-43118-2403070	/kamaz-4310/catalog/zapchasti/	419				1	1	1	1			КамАЗ-43114, КамАЗ-43118, КамАЗ-4326, КамАЗ-43501 (4х4), КамАЗ-53501 (6х6), КамАЗ-53504 (6х6), КамАЗ-6450 8х8, КамАЗ-63501 8х8, КамАЗ-4350 (4х4), КамАЗ-5350 (6х6), КамАЗ-6350 (8х8), КамАЗ-43261 (Евро-1, 2).		/kamaz-4310/img/zap/	43118-2403070_2.jpg											0.19	0.19	1.0	19.88			
418	Полуось правая короткая заднего моста КАМАЗ 53205	53205-2403070	17 500	24 000			0-	0-		-	завод, нет в наличии							53205-2403071	43118-2403069	43118-2403070		Мост задний		poluos-pravaya-53205-2403070	/kamaz-4310/catalog/zapchasti/	418							1	1	1	КАМАЗ-65115		/kamaz-4310/img/zap/												0.191	0.191	0.93	16.9			
420	Полуось левая длинная заднего моста КАМАЗ 53205	53205-2403071	21 500	28 000		4 900	0-	1-0		-	завод, в наличии							53205-2403070	43118-2403069			Мост задний		poluos-levaya-53205-2403071	/kamaz-4310/catalog/zapchasti/	420							1	1	1	КАМАЗ-65115		/kamaz-4310/img/zap/												0.19	0.19	1.21	20.6	Полуось КАМАЗ ЗМ левая 20 зубов без блокир. (ПАО КАМАЗ) 		
421	Синхронизатор 4-й и 5-й передач в сборе	14-1701151	6 107	4 950			1-	0-		10 530	завод, в наличии							142-1701151	15-1770160			Коробка передач	синхронизаторы	sinhronizator-4-j-i-5-j-peredach-v-sbore-14.1701151	/kamaz-4310/catalog/zapchasti/	421			1	1						КамАЗ-4310, КамАЗ-4326, КамАЗ-5315, КамАЗ-5320, КамАЗ-53212, КамАЗ-5410, КамАЗ-54112, КамАЗ-5511, КамАЗ-55102, КамАЗ-65115, ЗИЛ 133ГЯ, УРАЛ-4320, УРАЛ-43202, УРАЛ-5557, КамАЗ-43101, УРАЛ-4420.	Применяется для КП моделей 14,15, также в ограниченных комплектациях КП 141.	/kamaz-4310/img/zap/	14.1701151_2.jpg	14.1701151_3.jpg										0.19	0.072	0.025	0.16	Синхронизатор изготавливается из высокопрочных легированных сталей, кроме фрикционных колец, которые изготовлены из латуни. Допускается замена на синхронизатор 142.1701151 с одновременной установкой в КП первичного вала 142.1701027 (или 142.1701025), шестерни пятой передачи 142.1701115. Рекомендуется одновременно установить вторичный вал 142.1701105.		
423	Синхронизатор 4-й и 5-й передач в сборе	142-1701151	8 056	8 295			1-	1-		11 560	завод, в наличии							14-1701151	15-1770160			Коробка передач	синхронизаторы	sinhronizator-4-j-i-5-j-peredach-v-sbore-142.1701151	/kamaz-4310/catalog/zapchasti/	423					1	1	1	1	1	КамАЗ-43114, КамАЗ-43118, КамАЗ-4326 (каталог 2003г), КамАЗ-4308, 740.31-240 (Евро 2), КамАЗ-53228, 65111, КамАЗ-43261 (Евро-1, 2), КамАЗ-6540, 		/kamaz-4310/img/zap/	142.1701151_2.jpg											0.186	0.072	0.186	5.2			
425	Синхронизатор делителя КПП 15 КАМАЗ, с\сбор	15-1770160		5 250		4 950	-	0-1		8 300	завод, под заказ	6 560	аналог Наб.Челны					14-1701151	142-1701151			Коробка передач	синхронизаторы	sinhronizator-delitelya-kpp-ssbor-15.1770160	/kamaz-4310/catalog/zapchasti/	425							1			КамАЗ-5315, КамАЗ-5320, КамАЗ-53212, КамАЗ-5410, КамАЗ-54112, КамАЗ-5511, КамАЗ-55102		/kamaz-4310/img/zap/	15.1770160_2.jpg											0.187	0.087	0.187	5.3			
427	Синхронизатор делителя передач КПП 152 КАМАЗ	152-1770160	6 887	7 091			1-	1-		9 800	завод, в наличии							15-1770160	142-1701151			Коробка передач	синхронизаторы	sinhronizator-delitelya-peredach-kpp-152.1770160	/kamaz-4310/catalog/zapchasti/	427						1	1			КамАЗ-65115, КамАЗ-6540, КамАЗ-43118, 740.31-240 (Евро 2), КамАЗ-43261 (Евро-1, 2).		/kamaz-4310/img/zap/	152.1770160_2.jpg											0.2	0.1	0.2	5.35	Синхронизатор делителя передач в сборе 152.1770160. Устанавливается в модели КП 152 различных комплектаций. Допускается устанавливать вместо синхронизатора 15.1770160 в моделях КП 15.		
428	Синхронизатор делителя КПП 154 КАМАЗ	154-1770160	21 674	22 315		8 500	1-	1-0		27 540	завод							154-1701151				Коробка передач	синхронизаторы	sinhronizator-delitelya-peredach-kpp-154.1770160-kamaz	/kamaz-4310/catalog/zapchasti/													/kamaz-4310/img/zap/	154-1770160-sinhronizator-delitelya-kpp-154-kamaz_1.jpg											0.2	0.1	0.2	5.3	Синхронизатор делителя передач в сборе 155.1770160. Устанавливается в модели КП 154 различных комплектаций. 		
4281	Синхронизатор 4-5 передачи КПП-154 КАМАЗ	154-1701151	14 500	13 950		6 600	1-	0-0		17 300	завод, в наличии		аналог Наб.Челны					154-1770160				Коробка передач	синхронизаторы	sinhronizator-delitelya-peredach-kpp-154-1701151-kamaz	/kamaz-4310/catalog/zapchasti/													/kamaz-4310/img/zap/	154-1701151-sinhronizator-4-5-peredachi-kpp-154-kamaz.jpg											0.19	0.1	0.19	6			
