id	name	code1	k43-завод	мид-завод	k43-кооп	мид-кооп	нал-4310	нал мидкам	temp1	price1	price1_name	price2	price2_name	price3	price3_name	price4	price4_name	lk1	lk2	lk3	lk4	cat	cat2	url	path	ord	code2	code3	4310	4326	43114	43118	43261	4350	6450	prim	prim2	img_path	img1	img2	img3	img4	img5	par1	text1	par2	text2	par3	text3	w	h	l	m	desc	Comment	desc1
301	Вал ведущий главной передачи переднего моста	4310-2302024	7 000	7 000			0-	0-		8 700	завод, нет в наличии	8 600	аналог Наб.Челны	0	кооп			5320-2502201	4310-1802110			Редуктор	Валы	val-vedushchij-glavnoj-peredachi-perednego-mosta-4310-2302024	/kamaz-4310/catalog/zapchasti/	301			1	1						КамАЗ-4310, КамАЗ-43101, КамАЗ-43114, КамАЗ-43118, КамАЗ-4326, КамАЗ-43261 (Евро-1, 2) , КамАЗ-4350 (4х4) , КамАЗ-43501 (4х4) , КамАЗ-53228, 65111 		/kamaz-4310/img/zap/	4310-2302024_2.jpg																	
303	Вал вторичный коробки передач в сборе	14-1701105	12 500	12 100			1-	0-		14 230	завод, в наличии		аналог Наб.Челны					152-1770044	152-1701027	15-1770210-01	14-1701048	Коробка передач	Валы	val-vtorichnyj-korobki-peredach-v-sbore-14.1701105	/kamaz-4310/catalog/zapchasti/	303			1	1						КамАЗ-4310, КамАЗ-43101, КамАЗ-4326, КамАЗ-5315, КамАЗ-5320, КамАЗ-53212, КамАЗ-5410, КамАЗ-54112, КамАЗ-55102, КамАЗ-5511, КамАЗ-65115.	Применяется для КП моделей 14,15, также в ограниченных комплектациях КП 141.	/kamaz-4310/img/zap/	14.1701105_2.jpg															Вал устанавливается на модели КП 14, 15, различных комплектаций и в отдельные комплектации КП 141.	Обладает гарантированным ресурсом не менее 350 тыс. км.	 Синхронизатор изготавливается из высокопрочных легированных сталей, кроме фрикционных колец, которые изготовлены из латуни. Допускается замена на синхронизатор 142.1701151 с одновременной установкой в КП первичного вала 142.1701027 (или 142.1701025), шестерни пятой передачи 142.1701115. Рекомендуется одновременно установить вторичный вал 142.1701105. Обладает гарантированным ресурсом не менее 350 тыс. км.
305	Вал задний среднего моста	5320-2502201	6 810	7 000			1-	1-		9 800	завод, в наличии		аналог Наб.Челны					4310-2302024	65111-1802110			Редуктор	Валы	val-zadnij-srednego-mosta-5320-2502201	/kamaz-4310/catalog/zapchasti/	305					1	1	1	1		КамАЗ-43118, КамАЗ-43261,(Евро-1,2), КамАЗ-43501(4х4), КамАЗ-5320, КамАЗ-53212, КамАЗ-53228,65111, КамАЗ-5410, КамАЗ-54112, КамАЗ-55102, КамАЗ-5511, КамАЗ-65115, КамАЗ-65116, КамАЗ-6540.		/kamaz-4310/img/zap/	5320-2502201_2.jpg											0.06	0.06	0.665	6.41			
307	Вал первичный делителя передач КПП	152-1770044	9 000	6 400	9 180		0-1	0-		-	завод	10 700	аналог Наб.Челны					152-1701027	15-1770210-01	14-1701048	65111-1802026	Коробка передач	Валы	val-pervichnyj-delitelya-peredach-kpp-152.1770044	/kamaz-4310/catalog/zapchasti/	307		4310-1802024			1	1	1			КамАЗ-5315, КамАЗ-5320, КамАЗ-53212, КамАЗ-5410, КамАЗ-54112, КамАЗ-5511, КамАЗ-55102, КамАЗ-65115, ЗИЛ 133ГЯ, КамАЗ-6540, КамАЗ-43118, 740.31-240 (Евро 2), КамАЗ-43261 (Евро-1, 2).		/kamaz-4310/img/zap/	152.1770044_2.jpg											0.1	0.1	0.4	44016	Вал 152.1770044 первичный делителя передач. Вал устанавливается в модели КП 142, 152 различных комплектаций со сцеплением модели 142.		
309	Вал первичный коробки передач с втулкой (с делителем)	152-1701027	7 950	8 500	6 200	6 500	1-0	1-1		9 500	завод		аналог Наб.Челны	7 130	кооп			152-1770044	15-1770210-01	14-1701048	65111-1802025	Коробка передач	Валы	val-pervichnyj-korobki-peredach-s-vtulkoj-s-delitelem-152.1701027	/kamaz-4310/catalog/zapchasti/	309					1	1	1			КамАЗ-43118, КамАЗ-43261 (Евро-1, 2), КамАЗ-6540, 740.31-240 (Евро 2)		/kamaz-4310/img/zap/	152.1701027_3.jpg															Вал первичный коробки передач в сборе со втулкой, подшипником и муфтой синхронизатора, стянутыми кольцевой гайкой, застопоренной раскерниванием поя­ска в пазы вала. 	Устанавливается на модели КП 152 различных комплектаций. Имеет усиленную зубчатую муфту, прочность которой повышена за счет увеличения высоты зуба и площади контакта. Обладает гарантированным ресурсом не менее 500 тыс. км.	
310	Вал первичный КПП-142 в сборе с шестерней	142-1701025	13 835				0-	-		11 200	завод, в наличии, снятая с новой машины при установке делителя							152-1701027	65111-1802025			Коробка передач	Валы	val-pervichnyj-korobki-peredach-s-shesternya-142.1701025	/kamaz-4310/catalog/zapchasti/	310										КПП-142 КАМАЗ		/kamaz-4310/img/zap/	142-1701025_1.jpg	142-1701025_2.jpg																
311	Вал первичный РК (раздаточной коробки) голый	65111-1802025			3 150		-1	-		4 785	завод, нет в наличии	3 620	аналог Наб.Челны					65111-1802026	4310-1802024	43114-1802024		Коробка раздаточная	Валы	val-pervichnyj-rk-razdatochnoj-korobki-65111-1802025	/kamaz-4310/catalog/zapchasti/	311							1	1	1	КамАЗ-43261 (Евро-1, 2), КамАЗ-4350 (4х4), КамАЗ-43501 (4х4) 		/kamaz-4310/img/zap/	65111-1802025_2.jpg											0.08	0.08	0.268	5.36			
313	Вал первичный РК (раздаточной коробки) в сборе	65111-1802026	33 480	35 172			1-	0-		37 580	завод, в наличии	0	аналог Наб.Челны					65111-1802025	4310-1802024	43114-1802024		Коробка раздаточная	Валы	val-pervichnyj-rk-razdatochnoj-korobki-v-sbore-65111-1802024	/kamaz-4310/catalog/zapchasti/	313							1	1	1	КамАЗ-43261 (Евро-1, 2), КамАЗ-4350 (4х4), КамАЗ-43501 (4х4) 		/kamaz-4310/img/zap/	65111-1802024_2.jpg														18	в сборе с 034 шестерней 65111-1802024	Комплектация: 1) вал первичный РК 65111-1802025 - 1 шт 2) подшипник 7312 (30312) - 2 шт 3) шестерня ведущая первичного вала раздатки (65111-1802034) - 1 шт	
315	Вал первичный РК (раздаточной коробки) в сборе	4310-1802024					-	-		-	завод, производство прекращено		аналог	28 950	замена на <a href='/kamaz-4310/catalog/zapchasti/val-pervichnyj-rk-razdatochnoj-korobki-v-sbore-43114-1802024.html'>43114-1802024, перейти</a>			4310-1802024	65111-1802026	43114-1802024		Коробка раздаточная	Валы	val-pervichnyj-rk-razdatochnoj-korobki-v-sbore-4310-1802024	/kamaz-4310/catalog/zapchasti/	315			1	1						КамАЗ-4310, КамАЗ-43101		/kamaz-4310/img/zap/	4310-1802024_1.jpg											0.205	0.205	0.287	15.0	Делать в сборе взаимозаменяема на 43114-1802024		
317	Вал первичный РК (раздаточной коробки) в сборе	43114-1802024	24 757		14 700	14 000	0-1	-0		28 950	завод, в наличии	17 640	аналог Наб.Челны					4310-1802024	65111-1802026	65111-1802025		Коробка раздаточная	Валы	val-pervichnyj-rk-razdatochnoj-korobki-v-sbore-43114-1802024	/kamaz-4310/catalog/zapchasti/	317				1	1	1	1			КамАЗ-43114, КамАЗ-43118, КамАЗ-4326, КамАЗ-53228, 65111, КамАЗ-43261 (Евро-1, 2)		/kamaz-4310/img/zap/	43114-1802024_2.jpg											0.205	0.205	0.287	15.0			
319	Вал привода переднего моста	65111-1802110	9 211		4 278	2 800	0-0	-0		11 885	завод, нет в наличии	-	аналог Наб.Челны, в наличии					4310-1802110	65111-1802026			Мост передний	Валы	val-privoda-perednego-mosta-65111-1802110	/kamaz-4310/catalog/zapchasti/	319							1	1	1	КамАЗ-43261 (Евро-1, 2), КамАЗ-43501 (4х4), КамАЗ-53501 (6х6), КамАЗ-53504 (6х6), КамАЗ-6450 8х8, КамАЗ-63501 8х8.		/kamaz-4310/img/zap/	65111-1802110_2.jpg											0.07	0.07	0.486	6.8			
321	Вал привода переднего моста	4310-1802110	5 000	11 674			0-	1-		19 350	завод	0	аналог Наб.Челны					65111-1802110	4310-1802024			Мост передний	Валы	val-privoda-perednego-mosta-4310-1802110	/kamaz-4310/catalog/zapchasti/	321			1	1	1	1	1			КамАЗ-4310, КамАЗ-4326, КамАЗ-43101, КамАЗ-43114, КамАЗ-43118, КамАЗ-53228, 65111, КамАЗ-43261 (Евро-1, 2).		/kamaz-4310/img/zap/	4310-1802110_2.jpg											0.06	0.06	0.452	5.0			
323	Вал привода переднего моста	65111-1802110	9 211		4 278	2 800	0-0	-0		15 885	завод, нет в наличии	5 130	аналог Наб.Челны					4310-1802110	65111-1802026	65111-1802025		Мост передний	Валы	val-privoda-perednego-mosta-65111-1802110	/kamaz-4310/catalog/zapchasti/	323							1	1	1	КамАЗ-43261 (Евро-1, 2), КамАЗ-43501 (4х4) 		/kamaz-4310/img/zap/	65111-1802110_goliy_2.jpg											0.07	0.07	0.486	6.8	Вал КАМАЗ привода переднего моста на раздаточную коробку 65111. Размеры: 486х70.		
325	Вал промежуточный делителя передач в сборе	15-1770210-01	4 000	4 550			1-	1-		11 415	завод		аналог Наб.Челны					14-1701048	152-1770044	152-1701027		Коробка передач	Валы	val-promezhutochnyj-delitelya-peredach-v-sbore-15.1770210-01	/kamaz-4310/catalog/zapchasti/	325				1	1	1	1	1	1	КамАЗ-43114, -43118, -4350, -43253, -3229, -5511, -55111,  КамАЗ-6540, 740.31-240 (Евро 2), КамАЗ-43261 (Евро-1, 2).		/kamaz-4310/img/zap/	15.1770210-01_2.jpg											0.2	0.174	0.2	9.0			
327	Вал промежуточный КПП коробки передач	14-1701048					0-	-		-	завод, под заказ		аналог Наб.Челны	-	с хранения, по запросу			15-1770210-01	152-1770044	152-1701027		Коробка передач	Валы	val-promezhutochnyj-kpp-korobki-peredach-14.1701048	/kamaz-4310/catalog/zapchasti/	327			1	1	1	1	1	1	1	КамАЗ-4310, КамАЗ-4326, КамАЗ-5315, КамАЗ-5320, КамАЗ-53212, КамАЗ-5410, КамАЗ-54112, КамАЗ-5511, КамАЗ-55102, КамАЗ-65115, КамАЗ-5297, ЗИЛ 133ГЯ, УРАЛ-4320, УРАЛ-43202, УРАЛ-5557, КамАЗ-6540, КамАЗ-43114, КамАЗ-43118, КамАЗ-4308, 740.31-240 (Евро 2), КамАЗ-53228, 65111, КамАЗ-43261 (Евро-1, 2), УРАЛ-4420.		/kamaz-4310/img/zap/	14.1701048_2.jpg											0.12	0.12	0.5	16.4			
329	Вал промежуточный РК (раздаточной коробки) голый	43114-1802085	5 666		2 827		1-1	-		9 780	завод	3 250	аналог Наб.Челны					43114-1802084	4310-1802085	65111-1802085-10	65111-1802084-10	Коробка раздаточная	Валы	val-promezhutochnyj-rk-razdatochnoj-korobki-43114-1802085	/kamaz-4310/catalog/zapchasti/	329				1	1	1	1			КамАЗ-43114, КамАЗ-43118, КамАЗ-4326, КамАЗ-43261 Евро-1, 2, КамАЗ-53228, 65111		/kamaz-4310/img/zap/	43114-1802085_2.jpg											0.07	0.07	0.294	5.5			
331	Вал промежуточный РК (раздаточной коробки) голый	4310-1802085	3 000		2 827		1-1	-		5 175	завод	3 250	аналог Наб.Челны	3 250	с хранения, по запросу			4310-1802084	43114-1802085	65111-1802085-10	65111-1802084-10	Коробка раздаточная	Валы	val-promezhutochnyj-rk-razdatochnoj-korobki-4310-1802085	/kamaz-4310/catalog/zapchasti/	331			1							КамАЗ-4310, КамАЗ-43101		/kamaz-4310/img/zap/	4310-1802085_2.jpg											0.07	0.07	0.294	4.9			
333	Вал промежуточный РК (раздаточной коробки)	65111-1802085-10	7 000		2 827		0-1	-		9 495	завод, под заказ	3 250	аналог Наб.Челны					65111-1802084-10	4310-1802085	43114-1802085	4310-1802084	Коробка раздаточная	Валы	val-promezhutochnyj-rk-razdatochnoj-korobki-65111-1802085-10	/kamaz-4310/catalog/zapchasti/	333							1	1		КамАЗ-43261 (Евро-1, 2), КамАЗ-43502 (Евро 4), КамАЗ-65111 (Евро 4)		/kamaz-4310/img/zap/	65111-1802085-10_2.jpg											0.06	0.06	0.36	6.17			
335	Вал промежуточный РК (раздаточной коробки) в сборе	43114-1802084	31 453		20 350	35 980	0-1	-1		-	завод	23 400	аналог					43114-1802085	4310-1802084	65111-1802084-10	4310-1802085	Коробка раздаточная	Валы	val-promezhutochnyj-rk-razdatochnoj-korobki-v-sbore-43114-1802084	/kamaz-4310/catalog/zapchasti/	335				1	1	1	1			КамАЗ-43114, КамАЗ-43118, КамАЗ-4326, КамАЗ-53228, 65111, КамАЗ-43261 (Евро-1, 2)		/kamaz-4310/img/zap/	43114-1802084_2.jpg											0.071	0.071	0.294	21.5			
337	Вал промежуточный РК (раздаточной коробки) в сборе	4310-1802084			23 000		-1	-		48 900	завод, с хранения, (производство прекращено)	27 600	аналог	-	замена на <a href='/kamaz-4310/catalog/zapchasti/val-promezhutochnyj-rk-razdatochnoj-korobki-v-sbore-43114-1802084.html'>43114-1802084, перейти</a>			4310-1802085	43114-1802084	65111-1802084-10	65111-1802085-10	Коробка раздаточная	Валы	val-promezhutochnyj-rk-razdatochnoj-korobki-v-sbore-4310-1802084	/kamaz-4310/catalog/zapchasti/	337			1	1						КамАЗ-4310, КамАЗ-43101		/kamaz-4310/img/zap/	4310-1802084_2.jpg											0.2	0.2	0.29	25.0			
339	Вал промежуточный РК (раздаточной коробки) в сборе	65111-1802084-10	41 000	39 869	28 000		0-1	0-		59 000	завод	32 200	аналог Наб.Челны					65111-1802085-10	43114-1802084	4310-1802084	65111-1802152-10	Коробка раздаточная	Валы	val-promezhutochnyj-rk-razdatochnoj-korobki-v-sbore-65111-1802084-10	/kamaz-4310/catalog/zapchasti/	339							1			КамАЗ-43261 (Евро-1, 2) 		/kamaz-4310/img/zap/	65111-1802084-10_2.jpg											0.2	0.2	0.331	23.0	в сборе с шестерн.1802088, и 1802090, +каретка 1803018+2 подш. ролик.12611М		
341	Вилка блокировки дифференциала	4310-1802149	1 300	1 267			0-	0-		2 250	завод		аналог Наб.Челны					4310-1803020	65111-1802149			Мост передний	Вилки	vilka-blokirovki-differentsiala-4310-1802149	/kamaz-4310/catalog/zapchasti/	341			1	1	1	1	1			КамАЗ-4310, КамАЗ-4326, КамАЗ-43101, КамАЗ-43114, КамАЗ-43118, КамАЗ-53228, 65111, КамАЗ-43261 (Евро-1, 2)		/kamaz-4310/img/zap/	4310-1802149_2.jpg					Посадочный размер	18 мм.					0,035	0.158	0.104	0.62			
343	Вилка блокировки дифференциала раздаточной коробки	65111-1802149	3 400	3 750	1 820	2 000	0-1	0-0		5 865	завод	2 090	аналог Наб.Челны					4310-1802149	4310-1803020			Коробка раздаточная	Вилки	vilka-blokirovki-differentsiala-razdatochnoj-korobki-65111-1802149	/kamaz-4310/catalog/zapchasti/	343			1	1	1	1	1	1		КамАЗ-4310, КамАЗ-4326, КамАЗ-43101, КамАЗ-43114, КамАЗ-43118, КамАЗ-53228, 65111, КамАЗ-43261 (Евро-1, 2), КамАЗ-43501		/kamaz-4310/img/zap/	65111-1802149_2.jpg					Посадочный размер	18 мм.					0.035	0.162	0.11	0.6			
345	Вилка включения передачи РК (раздаточной коробки)	4310-1803020	2 800	2 130	1 700		0-1	0-		4 320	завод, нет в наличии	1 960	аналог Наб.Челны					4310-1803010-10	4310-1804010	4310-1802149	65111-1802149	Коробка раздаточная	Вилки	vilka-vklyucheniya-peredachi-rk-razdatochnoj-korobki-4310-1803020	/kamaz-4310/catalog/zapchasti/	345			1	1	1	1	1	1	1	КамАЗ-4310, КамАЗ-4326, КамАЗ-43101, КамАЗ-43114, КамАЗ-43118, КамАЗ-53228, 65111, КамАЗ-43501 (4х4), КамАЗ-53501 (6х6), КамАЗ-53504 (6х6), КамАЗ-6450 8х8, КамАЗ-63501 8х8, КамАЗ-4350 (4х4), КамАЗ-5350 (6х6), КамАЗ-6350 (8х8), КамАЗ-43261 (Евро-1, 2).		/kamaz-4310/img/zap/	4310-1803020_2.jpg											0.17	0.04	0.2	0.8	Длина 157 мм Высота 173 мм		
347	Вкладыш кулака шарнира	4310-2304066	902	6 500	2 150	1 820	0-1	1-0		8 625	завод, в наличии	14 550	комплект вкладыши + диск, нет в наличии					4310-2304067	4310-2304064	4310-2304062	53228-2304065	Мост передний	Вилки	vkladysh-kulaka-sharnira-4310-2304066	/kamaz-4310/catalog/zapchasti/	347			1	1	1	1	1	1		КамАЗ-4310, КамАЗ-43101, КамАЗ-43114, КамАЗ-43118, КамАЗ-4326, КамАЗ-43261 (Евро-1, 2), КамАЗ-4350 (4х4), КамАЗ-43501 (4х4), КамАЗ-53228, 65111	для переднего ведущего моста	/kamaz-4310/img/zap/	4310-2304066_2.jpg	4310-2304066_3.jpg										0.084	0.057	0.122	1.87			
349	Головка подвода воздуха в сборе	4310-3124010	2 722				1-	-		3 735	завод, в наличии		аналог КМД	-	с хранения, по запросу							Подвод воздуха к шинам		golovka-podvoda-vozduha-v-sbore-4310-3124010	/kamaz-4310/catalog/zapchasti/	349	Р620-3124000		1	1	1	1	1	1		КамАЗ-4310, КамАЗ-4326, КамАЗ-43101, КамАЗ-43114, КамАЗ-43118, КамАЗ-43261 (Евро-1, 2)	Применяется для автомобилей КамАЗ-4310, КамАЗ-4326, КамАЗ-43101, КамАЗ-4310, КамАЗ-43114, КамАЗ-43118	/kamaz-4310/img/zap/	4310-3124010_2.jpg											0.1	0.04	0.1	0.88	Данная головка устанавливается внутри колесных цапф полуоси. Она состоит из двух эластичных манжет с нажимными пружинами, которые обеспечивают герметичность подвижного соединения.<br />Артикул - 4310-3124010<br />Применяется в ходовой части, колесах и ступице автомобиля.		
357	Диск нажимной (корзина) в сборе	14-1601090-10	16 800	16 000			1-	1-		23 500	завод		аналог Наб.Челны					142-1601090	#REF!	#REF!		Сцепление		disk-nazhimnoj-korzina-v-sbore-14.1601090-10	/kamaz-4310/catalog/zapchasti/	357			1							КамАЗ-4310, КамАЗ-5320, КамАЗ-53212, КамАЗ-5410, КамАЗ-54112, КамАЗ-5511, КамАЗ-55102, ЗИЛ 133ГЯ, УРАЛ-4320, УРАЛ-43202, УРАЛ-5557, КамАЗ-43101, УРАЛ-4420.		/kamaz-4310/img/zap/	14.1601090-10_2.jpg											0.11	0.39	0.39	25.62	Штампованный на ПРЗ кожух, кованные рычаги. Одинарные нажимные пружины.		
359	Диск нажимной (корзина) сцепления с кожухом	142-1601090	17 800	18 800			0-	1-		24 500	завод		аналог Наб.Челны					14-1601090-10	#REF!	#REF!	5320-1609510	Сцепление		disk-nazhimnoj-korzina-stsepleniya-s-kozhuhom-142.1601090	/kamaz-4310/catalog/zapchasti/	359				1	1		1			КамАЗ-4326, КамАЗ-5315, КамАЗ-65115, КамАЗ-5297, КамАЗ-43114, КамАЗ-4326, 740.31-240 (Евро 2), КамАЗ-53228, 65111, КамАЗ-43261 (Евро-1, 2), Д-260.5Е3.		/kamaz-4310/img/zap/	142.1601090_2.jpg											0.11	0.412	0.412		Штампованный на ПРЗ кожух, кованные рычаги. Двойные нажимные пружины. 		
361	Диск шарнира ШРУС - Шарнир равных угловых скоростей	4310-2304067	2 650	3 250			0-	1-		4 875	завод, в наличии, кованный 'пятак-шайба'	14 550	комплект вкладыши + диск, нет в наличии					4310-2304066	4310-2304067	4310-2304062		Мост передний		disk-sharnira-4310-2304067	/kamaz-4310/catalog/zapchasti/	361			1	1	1	1	1	1	1	КамАЗ-4310, КамАЗ-4326, КамАЗ-43114, КамАЗ-43118, КамАЗ-53228, 65111,  КамАЗ-53501 (6х6), КамАЗ-53504 (6х6), КамАЗ-6450 8х8, КамАЗ-63501 8х8, КамАЗ-4350 (4х4), КамАЗ-5350 (6х6), КамАЗ-6350 (8х8), КамАЗ-43261 (Евро-1, 2).		/kamaz-4310/img/zap/	4310-2304067_2.jpg											0.098	0.027	0.098	1.56			
363	Дифференциал заднего моста (50 зубьев)	53229-2403011-20		60 000			-	0-		-	завод, под заказ		аналог Наб.Челны					65111-1802152-10	43114-1802152			Редуктор	Диф	differentsial-zadnego-mosta-53229-2403011-20	/kamaz-4310/catalog/zapchasti/	363				1	1	1	1	1	1	КамАЗ-43114, КамАЗ-43118, КамАЗ-4326, КамАЗ-43261 (Евро-1, 2), КамАЗ-4350 (4х4), КамАЗ-43501 (4х4), КамАЗ-53228, 65111, 		/kamaz-4310/img/zap/	53229-2403011-20_differentsial_zadnego_mosta_v_sbore_2.jpg														42.3	i=7,22		
365	Дифференциал РК (раздаточной коробки) 44 зубьев в сборе	65111-1802152-10	175 000	88 800	75 980		1-0	0-		200 000	самосбор из заводских запчастей, без НДС, в наличии	134 000	восстановленный, без НДС, в наличии	200 000	самосбор из заводских запчастей, без НДС, в наличии			4310-1802150	43114-1802152	65111-1802155-10	65111-1802085-10	Коробка раздаточная	Диф	differentsial-rk-razdatochnoj-korobki-v-sbore-65111-1802150-10	/kamaz-4310/catalog/zapchasti/	365	65111-1802150-10			1	1	1	1	1	1	КамАЗ-43114, КамАЗ-43118, КамАЗ-53228, 65111, КамАЗ-43261 (Евро-1, 2).		/kamaz-4310/img/zap/	65111-1802150-10_2.jpg	65111-1802150-10_1.jpg										0.24	0.24	0.47	51	Дифференциал 65111-1802150-10 это подсборочный узел для конвейерной сборки и в запасные части не должен поступать, так как в состав данного узла не входят подшипники в сборе. Нет наружного кольца. Для запасных частей предусмотрен дифференциал 65111-1802152-10		
367	Дифференциал РК (раздаточной коробки) в сборе	4310-1802150					-	-		-	завод, с консервации, уточняйте		аналог Наб.Челны	-	заменен на 43114-1802152			43114-1802152	65111-1802152-10	43114-1802155	4310-1802085	Коробка раздаточная	Диф	differentsial-rk-razdatochnoj-korobki-v-sbore-4310-1802150	/kamaz-4310/catalog/zapchasti/	367			1							КамАЗ-4310, КамАЗ-43101		/kamaz-4310/img/zap/	4310-1802150_2.jpg											0.24	0.24	0.47	43.6	Дифферинциал 4310-1802150 снят с производства и заменен на 43114-1802152	Установка 43114 вместо 4310 возможна. Дифференциал 43114 отличается от 4310 следующим: разные обоймы дифференциала, отличающиеся способом крепления к шестерни низшей передачи, и вместо шестерни низшей передачи 4310-1802189 установлена 43114 с  измененной ступицей.	
